{
  "$schema": "https://json-schema.org/draft/2020-12/schema",
  "$id": "https://psp.dev/schemas/harness-manifest.schema.json",
  "title": "PSP Repository Harness Manifest",
  "type": "object",
  "additionalProperties": false,
  "required": ["$schema", "name", "version", "runtime", "entrypoints", "schemas", "codex", "readOrder", "domainRegistry", "artifactRegistry", "operations", "commands", "validationProfiles", "scopes", "evidenceReport", "blockers"],
  "properties": {
    "$schema": {"type": "string", "minLength": 1},
    "name": {"$ref": "#/$defs/identifier"},
    "version": {"type": "string", "pattern": "^[0-9]+\\.[0-9]+\\.[0-9]+$"},
    "runtime": {"type": "object", "additionalProperties": false, "required": ["protocol", "authority", "entrypoint", "dependencyLock", "dependencyCache"], "properties": {"protocol": {"const": "pre-sdd-harness/v2"}, "authority": {"const": "generated-workspace-local"}, "entrypoint": {"const": ".psp/runtime/pre-sdd/bin/pre-sdd.mjs"}, "dependencyLock": {"const": "package-lock.json"}, "dependencyCache": {"const": "os-temporary-directory"}}},
    "entrypoints": {"type": "object", "additionalProperties": false, "required": ["instructions", "protocol", "boundary", "project", "manifest", "repository"], "properties": {"instructions": {"$ref": "#/$defs/path"}, "protocol": {"$ref": "#/$defs/path"}, "boundary": {"$ref": "#/$defs/path"}, "project": {"$ref": "#/$defs/path"}, "manifest": {"$ref": "#/$defs/path"}, "repository": {"$ref": "#/$defs/path"}}},
    "schemas": {"type": "object", "additionalProperties": false, "required": ["manifest", "project", "contract"], "properties": {"manifest": {"$ref": "#/$defs/path"}, "project": {"$ref": "#/$defs/path"}, "contract": {"$ref": "#/$defs/path"}}},
    "codex": {"type": "object", "additionalProperties": false, "required": ["projectConfig", "hookConfig", "hookScripts", "repositorySkills"], "properties": {"projectConfig": {"$ref": "#/$defs/path"}, "hookConfig": {"$ref": "#/$defs/path"}, "hookScripts": {"type": "array", "minItems": 1, "items": {"$ref": "#/$defs/path"}}, "repositorySkills": {"type": "array", "minItems": 1, "items": {"$ref": "#/$defs/path"}}}},
    "readOrder": {"type": "array", "minItems": 4, "items": {"$ref": "#/$defs/path"}},
    "domainRegistry": {"type": "array", "minItems": 1, "items": {"$ref": "#/$defs/domain"}},
    "artifactRegistry": {"type": "array", "minItems": 1, "items": {"$ref": "#/$defs/artifact"}},
    "operations": {"type": "array", "minItems": 1, "items": {"$ref": "#/$defs/operation"}},
    "commands": {"type": "array", "minItems": 1, "items": {"$ref": "#/$defs/command"}},
    "validationProfiles": {"type": "array", "minItems": 1, "items": {"$ref": "#/$defs/profile"}},
    "scopes": {"type": "array", "minItems": 1, "items": {"$ref": "#/$defs/scope"}},
    "evidenceReport": {"type": "object", "additionalProperties": false, "required": ["requiredFields", "validationStates"], "properties": {"requiredFields": {"type": "array", "items": {"type": "string"}}, "validationStates": {"type": "array", "items": {"enum": ["PASS", "FAIL", "BLOCKED", "NOT_RUN"]}}}},
    "blockers": {"type": "array", "minItems": 1, "items": {"$ref": "#/$defs/blocker"}}
  },
  "$defs": {
    "identifier": {"type": "string", "pattern": "^[a-z][a-z0-9-]*$"},
    "blockerCode": {"type": "string", "pattern": "^AIH_[A-Z0-9_]+$"},
    "path": {"type": "string", "minLength": 1, "pattern": "^(?![A-Za-z]:)(?!/)(?!.*\\\\)(?!.*(?:^|/)\\.{1,2}(?:/|$))(?!.*[*!?\\[\\]{}]).+$"},
    "globPath": {"type": "string", "minLength": 1, "pattern": "^(?![A-Za-z]:)(?!/)(?!.*\\\\)(?!.*(?:^|/)\\.{1,2}(?:/|$)).+$"},
    "domain": {"type": "object", "additionalProperties": false, "required": ["id", "skill", "root"], "properties": {"id": {"$ref": "#/$defs/identifier"}, "skill": {"$ref": "#/$defs/identifier"}, "root": {"$ref": "#/$defs/path"}, "mirrors": {"type": "array", "items": {"$ref": "#/$defs/path"}}}},
    "artifactBase": {"type": "object", "properties": {"id": {"$ref": "#/$defs/identifier"}, "stage": {"$ref": "#/$defs/identifier"}, "domain": {"$ref": "#/$defs/identifier"}, "format": {"enum": ["yaml", "json", "typescript"]}, "contract": {"$ref": "#/$defs/path"}, "schema": {"$ref": "#/$defs/path"}}},
    "artifact": {"oneOf": [
      {"type": "object", "additionalProperties": false, "required": ["id", "stage", "domain", "authorityKind", "format", "contract", "schema", "template", "renderer"], "properties": {"id": {"$ref": "#/$defs/identifier"}, "stage": {"$ref": "#/$defs/identifier"}, "domain": {"$ref": "#/$defs/identifier"}, "authorityKind": {"const": "internal-model"}, "format": {"enum": ["yaml", "json"]}, "contract": {"$ref": "#/$defs/path"}, "schema": {"$ref": "#/$defs/path"}, "template": {"$ref": "#/$defs/path"}, "renderer": {"$ref": "#/$defs/identifier"}}},
      {"type": "object", "additionalProperties": false, "required": ["id", "stage", "domain", "authorityKind", "format", "contract", "schema", "projector"], "properties": {"id": {"$ref": "#/$defs/identifier"}, "stage": {"$ref": "#/$defs/identifier"}, "domain": {"$ref": "#/$defs/identifier"}, "authorityKind": {"const": "area"}, "format": {"const": "typescript"}, "contract": {"$ref": "#/$defs/path"}, "schema": {"$ref": "#/$defs/path"}, "projector": {"$ref": "#/$defs/identifier"}}}
    ]},
    "executor": {"oneOf": [
      {"type": "object", "additionalProperties": false, "required": ["kind", "path"], "properties": {"kind": {"const": "module"}, "path": {"$ref": "#/$defs/path"}, "args": {"type": "array", "items": {"type": "string"}}}},
      {"type": "object", "additionalProperties": false, "required": ["kind", "paths"], "properties": {"kind": {"const": "node-test"}, "paths": {"type": "array", "minItems": 1, "items": {"$ref": "#/$defs/globPath"}}}},
      {"type": "object", "additionalProperties": false, "required": ["kind", "area", "script"], "properties": {"kind": {"const": "area-script"}, "area": {"$ref": "#/$defs/identifier"}, "script": {"$ref": "#/$defs/identifier"}}}
    ]},
    "command": {"type": "object", "additionalProperties": false, "required": ["id", "npmScript", "run", "purpose", "blocking", "executor"], "properties": {"id": {"$ref": "#/$defs/identifier"}, "npmScript": {"type": "string", "minLength": 1}, "run": {"type": "string", "pattern": "^npm run "}, "purpose": {"type": "string", "minLength": 1}, "blocking": {"type": "boolean"}, "domain": {"$ref": "#/$defs/identifier"}, "executor": {"$ref": "#/$defs/executor"}}},
    "operation": {"oneOf": [
      {"type": "object", "additionalProperties": false, "required": ["id", "kind", "npmScript", "run", "executor"], "properties": {"id": {"$ref": "#/$defs/identifier"}, "kind": {"const": "workspace"}, "npmScript": {"type": "string"}, "run": {"type": "string"}, "executor": {"$ref": "#/$defs/executor"}}},
      {"type": "object", "additionalProperties": false, "required": ["id", "kind", "npmScript", "run", "executor", "stage", "fromState", "toState", "areaTemplates", "commands"], "properties": {"id": {"$ref": "#/$defs/identifier"}, "kind": {"const": "stage"}, "npmScript": {"type": "string"}, "run": {"type": "string"}, "executor": {"$ref": "#/$defs/executor"}, "stage": {"$ref": "#/$defs/identifier"}, "fromState": {"const": "uninitialized"}, "toState": {"const": "active"}, "areaTemplates": {"type": "object", "additionalProperties": {"$ref": "#/$defs/path"}}, "commands": {"type": "array", "minItems": 1, "items": {"$ref": "#/$defs/identifier"}}, "upstreamHandoff": {"type": "object", "additionalProperties": false, "required": ["from", "to"], "properties": {"from": {"$ref": "#/$defs/identifier"}, "to": {"$ref": "#/$defs/identifier"}}}}},
      {"type": "object", "additionalProperties": false, "required": ["id", "kind", "npmScript", "run", "executor", "domain", "stage", "artifacts"], "properties": {"id": {"$ref": "#/$defs/identifier"}, "kind": {"const": "artifact"}, "npmScript": {"type": "string"}, "run": {"type": "string"}, "executor": {"$ref": "#/$defs/executor"}, "domain": {"$ref": "#/$defs/identifier"}, "stage": {"$ref": "#/$defs/identifier"}, "artifacts": {"type": "array", "minItems": 1, "uniqueItems": true, "items": {"$ref": "#/$defs/identifier"}}}},
      {"type": "object", "additionalProperties": false, "required": ["id", "kind", "npmScript", "run", "executor", "domain", "stage", "artifact"], "properties": {"id": {"$ref": "#/$defs/identifier"}, "kind": {"const": "repair"}, "npmScript": {"type": "string"}, "run": {"type": "string"}, "executor": {"$ref": "#/$defs/executor"}, "domain": {"$ref": "#/$defs/identifier"}, "stage": {"$ref": "#/$defs/identifier"}, "artifact": {"$ref": "#/$defs/identifier"}}},
      {"type": "object", "additionalProperties": false, "required": ["id", "kind", "npmScript", "run", "executor"], "properties": {"id": {"const": "handoff"}, "kind": {"const": "handoff"}, "npmScript": {"const": "handoff"}, "run": {"const": "npm run handoff"}, "executor": {"$ref": "#/$defs/executor"}}}
    ]},
    "profile": {"type": "object", "additionalProperties": false, "required": ["id", "commands"], "properties": {"id": {"$ref": "#/$defs/identifier"}, "commands": {"type": "array", "minItems": 1, "uniqueItems": true, "items": {"$ref": "#/$defs/identifier"}}}},
    "selector": {"oneOf": [
      {"type": "object", "additionalProperties": false, "required": ["type", "paths"], "properties": {"type": {"const": "static"}, "paths": {"type": "array", "minItems": 1, "items": {"$ref": "#/$defs/globPath"}}}},
      {"type": "object", "additionalProperties": false, "required": ["type", "marker"], "properties": {"type": {"const": "workspace"}, "marker": {"$ref": "#/$defs/path"}}},
      {"type": "object", "additionalProperties": false, "required": ["type", "domain"], "properties": {"type": {"const": "domain"}, "domain": {"$ref": "#/$defs/identifier"}}},
      {"type": "object", "additionalProperties": false, "required": ["type", "stage"], "properties": {"type": {"const": "stage"}, "stage": {"$ref": "#/$defs/identifier"}}},
      {"type": "object", "additionalProperties": false, "required": ["type", "stage", "area"], "properties": {"type": {"const": "area"}, "stage": {"$ref": "#/$defs/identifier"}, "area": {"$ref": "#/$defs/identifier"}}},
      {"type": "object", "additionalProperties": false, "required": ["type", "stage", "artifacts"], "properties": {"type": {"const": "artifact"}, "stage": {"$ref": "#/$defs/identifier"}, "artifacts": {"type": "array", "minItems": 1, "items": {"$ref": "#/$defs/identifier"}}, "areas": {"type": "array", "items": {"$ref": "#/$defs/identifier"}}}}
    ]},
    "scope": {"type": "object", "additionalProperties": false, "required": ["id", "kind", "selectionGroup", "priority", "status", "selector", "defaultProfile", "readinessProfile"], "properties": {"id": {"$ref": "#/$defs/identifier"}, "kind": {"enum": ["workspace", "repository", "domain", "stage", "artifact", "subtree"]}, "domain": {"$ref": "#/$defs/identifier"}, "selectionGroup": {"$ref": "#/$defs/identifier"}, "priority": {"type": "integer", "minimum": 0}, "status": {"enum": ["active", "unsupported"]}, "selector": {"$ref": "#/$defs/selector"}, "defaultProfile": {"$ref": "#/$defs/identifier"}, "readinessProfile": {"$ref": "#/$defs/identifier"}, "uninitializedProfile": {"$ref": "#/$defs/identifier"}, "blockerCode": {"$ref": "#/$defs/blockerCode"}, "dependencies": {"type": "array", "items": {"$ref": "#/$defs/identifier"}}, "handoffConsumers": {"type": "array", "items": {"$ref": "#/$defs/identifier"}}, "externalConsumers": {"type": "array", "items": {"type": "string"}}}},
    "blocker": {"type": "object", "additionalProperties": false, "required": ["code", "severity", "owner", "meaning"], "properties": {"code": {"$ref": "#/$defs/blockerCode"}, "severity": {"enum": ["blocker", "high", "medium", "low"]}, "owner": {"$ref": "#/$defs/identifier"}, "domain": {"$ref": "#/$defs/identifier"}, "meaning": {"type": "string", "minLength": 1}}}
  }
}
