{
  "$schema": "./schemas/harness-manifest.schema.json",
  "name": "psp-repository-ai-coding-harness",
  "version": "12.1.0",
  "runtime": {
    "protocol": "pre-sdd-harness/v2",
    "authority": "generated-workspace-local",
    "entrypoint": ".psp/runtime/pre-sdd/bin/pre-sdd.mjs",
    "dependencyLock": "package-lock.json",
    "dependencyCache": "os-temporary-directory"
  },
  "entrypoints": {
    "instructions": "AGENTS.md",
    "protocol": ".psp/harness/HARNESS.md",
    "boundary": ".psp/harness/HARNESS-BOUNDARY.md",
    "project": "psp.project.yaml",
    "manifest": ".psp/harness/harness.manifest.json",
    "repository": "README.md"
  },
  "schemas": {
    "manifest": ".psp/harness/schemas/harness-manifest.schema.json",
    "project": ".psp/harness/schemas/project.schema.json",
    "contract": ".psp/harness/schemas/artifact-contract.schema.json"
  },
  "codex": {
    "projectConfig": ".codex/config.toml",
    "hookConfig": ".codex/hooks.json",
    "hookScripts": [
      ".codex/hooks/validate-harness.mjs"
    ],
    "repositorySkills": [
      ".agents/skills/apply-repository-harness/SKILL.md",
      ".agents/skills/product-design/SKILL.md",
      ".agents/skills/architecture-design/SKILL.md",
      ".agents/skills/capture-figma-design-source/SKILL.md",
      ".agents/skills/organize-figma-assets/SKILL.md",
      ".agents/skills/figma-component-from-design/SKILL.md",
      ".agents/skills/implement-figma-lit-page/SKILL.md",
      ".agents/skills/repair-canonical-ui-visual/SKILL.md"
    ]
  },
  "readOrder": [
    "AGENTS.md",
    ".psp/harness/HARNESS.md",
    ".psp/harness/HARNESS-BOUNDARY.md",
    "psp.project.yaml",
    ".psp/harness/harness.manifest.json"
  ],
  "artifactRegistry": [
    {
      "id": "product-package",
      "stage": "product-design",
      "domain": "product-design",
      "authorityKind": "internal-model",
      "format": "yaml",
      "contract": ".agents/skills/product-design/product-package/contract.yaml",
      "schema": ".agents/skills/product-design/product-package/schema.json",
      "template": ".agents/skills/product-design/product-package/template.yaml",
      "renderer": "product-package-markdown"
    },
    {
      "id": "capabilities",
      "stage": "product-design",
      "domain": "product-design",
      "authorityKind": "internal-model",
      "format": "yaml",
      "contract": ".agents/skills/product-design/capabilities/contract.yaml",
      "schema": ".agents/skills/product-design/capabilities/schema.json",
      "template": ".agents/skills/product-design/capabilities/template.yaml",
      "renderer": "capabilities-markdown"
    },
    {
      "id": "interactions",
      "stage": "product-design",
      "domain": "product-design",
      "authorityKind": "internal-model",
      "format": "yaml",
      "contract": ".agents/skills/product-design/interactions/contract.yaml",
      "schema": ".agents/skills/product-design/interactions/schema.json",
      "template": ".agents/skills/product-design/interactions/template.yaml",
      "renderer": "interactions-markdown"
    },
    {
      "id": "canonical-ui-prototype",
      "stage": "product-design",
      "domain": "product-design",
      "authorityKind": "area",
      "format": "typescript",
      "contract": ".agents/skills/product-design/canonical-ui-prototype/contract.yaml",
      "schema": ".agents/skills/product-design/canonical-ui-prototype/schema.json",
      "projector": "render-product"
    },
    {
      "id": "architecture-package",
      "stage": "architecture-design",
      "domain": "architecture-design",
      "authorityKind": "internal-model",
      "format": "yaml",
      "contract": ".agents/skills/architecture-design/architecture-package/contract.yaml",
      "schema": ".agents/skills/architecture-design/architecture-package/schema.json",
      "template": ".agents/skills/architecture-design/architecture-package/template.yaml",
      "renderer": "architecture-package-markdown"
    },
    {
      "id": "system-boundary",
      "stage": "architecture-design",
      "domain": "architecture-design",
      "authorityKind": "internal-model",
      "format": "yaml",
      "contract": ".agents/skills/architecture-design/system-boundary/contract.yaml",
      "schema": ".agents/skills/architecture-design/system-boundary/schema.json",
      "template": ".agents/skills/architecture-design/system-boundary/template.yaml",
      "renderer": "system-boundary-markdown"
    },
    {
      "id": "conceptual-model",
      "stage": "architecture-design",
      "domain": "architecture-design",
      "authorityKind": "internal-model",
      "format": "yaml",
      "contract": ".agents/skills/architecture-design/conceptual-model/contract.yaml",
      "schema": ".agents/skills/architecture-design/conceptual-model/schema.json",
      "template": ".agents/skills/architecture-design/conceptual-model/template.yaml",
      "renderer": "conceptual-model-markdown"
    },
    {
      "id": "technical-validation",
      "stage": "architecture-design",
      "domain": "architecture-design",
      "authorityKind": "internal-model",
      "format": "yaml",
      "contract": ".agents/skills/architecture-design/technical-validation/contract.yaml",
      "schema": ".agents/skills/architecture-design/technical-validation/schema.json",
      "template": ".agents/skills/architecture-design/technical-validation/template.yaml",
      "renderer": "technical-validation-markdown"
    }
  ],
  "operations": [
    {
      "id": "initialize-workspace",
      "kind": "workspace",
      "npmScript": "init:workspace",
      "run": "npm run init:workspace",
      "executor": {
        "kind": "module",
        "path": ".psp/harness/scripts/init-workspace.mjs"
      }
    },
    {
      "id": "initialize-product",
      "kind": "stage",
      "npmScript": "init:product",
      "run": "npm run init:product",
      "executor": {
        "kind": "module",
        "path": ".psp/harness/scripts/initialize-stage.mjs",
        "args": [
          "--operation",
          "initialize-product"
        ]
      },
      "stage": "product-design",
      "fromState": "uninitialized",
      "toState": "active",
      "areaTemplates": {
        "canonical-ui-prototype": ".agents/skills/product-design/canonical-ui-prototype/template"
      },
      "commands": [
        "render-product",
        "product-structure"
      ]
    },
    {
      "id": "initialize-architecture",
      "kind": "stage",
      "npmScript": "init:architecture",
      "run": "npm run init:architecture",
      "executor": {
        "kind": "module",
        "path": ".psp/harness/scripts/initialize-stage.mjs",
        "args": [
          "--operation",
          "initialize-architecture"
        ]
      },
      "stage": "architecture-design",
      "fromState": "uninitialized",
      "toState": "active",
      "areaTemplates": {
        "technical-validation": ".agents/skills/architecture-design/technical-validation/template-area"
      },
      "commands": [
        "render-architecture",
        "architecture-structure"
      ],
      "upstreamHandoff": {
        "from": "use-cases",
        "to": "architecture-design"
      }
    },
    {
      "id": "apply-product-artifact",
      "kind": "artifact",
      "npmScript": "apply:product-artifact",
      "run": "npm run apply:product-artifact",
      "executor": {
        "kind": "module",
        "path": ".agents/skills/product-design/scripts/apply-artifact.mjs",
        "args": [
          "--operation",
          "apply-product-artifact"
        ]
      },
      "domain": "product-design",
      "stage": "product-design",
      "artifacts": [
        "product-package",
        "capabilities",
        "interactions"
      ]
    },
    {
      "id": "apply-architecture-artifact",
      "kind": "artifact",
      "npmScript": "apply:architecture-artifact",
      "run": "npm run apply:architecture-artifact",
      "executor": {
        "kind": "module",
        "path": ".agents/skills/architecture-design/scripts/apply-artifact.mjs",
        "args": [
          "--operation",
          "apply-architecture-artifact"
        ]
      },
      "domain": "architecture-design",
      "stage": "architecture-design",
      "artifacts": [
        "architecture-package",
        "system-boundary",
        "conceptual-model",
        "technical-validation"
      ]
    },
    {
      "id": "canonical-ui-repair",
      "kind": "repair",
      "npmScript": "repair:canonical-ui",
      "run": "npm run repair:canonical-ui",
      "executor": {
        "kind": "module",
        "path": ".agents/skills/product-design/canonical-ui-prototype/scripts/repair.mjs",
        "args": [
          "--json"
        ]
      },
      "domain": "product-design",
      "stage": "product-design",
      "artifact": "canonical-ui-prototype"
    },
    {
      "id": "handoff",
      "kind": "handoff",
      "npmScript": "handoff",
      "run": "npm run handoff",
      "executor": {
        "kind": "module",
        "path": ".psp/harness/scripts/run-handoff.mjs"
      }
    }
  ],
  "commands": [
    {
      "id": "harness",
      "npmScript": "validate:harness",
      "run": "npm run validate:harness",
      "purpose": "校验 Harness、项目绑定、Contract、Codex 接入与 resolver",
      "blocking": true,
      "executor": {
        "kind": "module",
        "path": ".psp/harness/scripts/validate-harness.mjs"
      }
    },
    {
      "id": "workspace-structure",
      "npmScript": "validate:workspace",
      "run": "npm run validate:workspace",
      "purpose": "校验纯脚手架目录骨架、阶段空状态和用户实例隔离",
      "blocking": true,
      "executor": {
        "kind": "module",
        "path": ".psp/harness/scripts/init-workspace.mjs",
        "args": [
          "--dry-run"
        ]
      }
    },
    {
      "id": "test-harness",
      "npmScript": "test:harness",
      "run": "npm run test:harness",
      "purpose": "运行 Harness contract tests",
      "blocking": true,
      "executor": {
        "kind": "node-test",